{
  "schema_version": "scc.eval_manifest.v1",
  "updated_at": "2026-02-05",
  "tiers": {
    "smoke": { "commands": ["python -m compileall ."], "max_minutes": 5 },
    "regression": { "commands": ["pytest -q"], "max_minutes": 60 }
  },
  "task_classes": {
    "ci_fixup_v1": {
      "smoke": { "commands": ["pytest -q -k smoke"], "max_minutes": 10 }
    }
  }
}

